[{"id":1,"month":1,"start_day":1,"end_day":5,"name":"日脚伸び始む","reading":"ひあしのびはじむ","confidence":"A","category":"天文・光","phase":"開始"},{"id":2,"month":1,"start_day":6,"end_day":10,"name":"蝋梅香立つ","reading":"ろうばいかおりたつ","confidence":"A−","category":"植物","phase":"最盛"},{"id":3,"month":1,"start_day":11,"end_day":15,"name":"目白花を訪う","reading":"めじろはなをとう","confidence":"A","category":"鳥・植物","phase":"最盛"},{"id":4,"month":1,"start_day":16,"end_day":20,"name":"寒さ底打つ","reading":"さむさそこうつ","confidence":"B+","category":"気象","phase":"最盛"},{"id":5,"month":1,"start_day":21,"end_day":25,"name":"梅ほころぶ","reading":"うめほころぶ","confidence":"S","category":"植物","phase":"開始"},{"id":6,"month":1,"start_day":26,"end_day":31,"name":"水仙香る","reading":"すいせんかおる","confidence":"A","category":"植物","phase":"最盛"},{"id":7,"month":2,"start_day":1,"end_day":5,"name":"椿咲き初む","reading":"つばきさきそむ","confidence":"A","category":"植物","phase":"開始"},{"id":8,"month":2,"start_day":6,"end_day":10,"name":"犬ふぐり青む","reading":"いぬふぐりあおむ","confidence":"A","category":"植物","phase":"開始"},{"id":9,"month":2,"start_day":11,"end_day":15,"name":"蕗の薹土を割る","reading":"ふきのとうつちをわる","confidence":"A−","category":"植物","phase":"最盛"},{"id":10,"month":2,"start_day":16,"end_day":20,"name":"赤蛙水辺に声立つ","reading":"あかがえるみずべにこえたつ","confidence":"S","category":"両生類","phase":"開始・最盛"},{"id":11,"month":2,"start_day":21,"end_day":25,"name":"越冬蝶日向に舞う","reading":"ふゆごしちょうひなたにまう","confidence":"A","category":"昆虫","phase":"開始"},{"id":12,"month":2,"start_day":26,"end_day":28,"name":"鶯初音","reading":"うぐいすはつね","confidence":"A−","category":"鳥","phase":"開始"},{"id":13,"month":3,"start_day":1,"end_day":5,"name":"土筆野に出づ","reading":"つくしのにいづ","confidence":"S","category":"植物","phase":"開始"},{"id":14,"month":3,"start_day":6,"end_day":10,"name":"雲雀空に囀る","reading":"ひばりそらにさえずる","confidence":"B+","category":"鳥","phase":"開始"},{"id":15,"month":3,"start_day":11,"end_day":15,"name":"沈丁花香満つ","reading":"じんちょうげかおりみつ","confidence":"A+","category":"植物","phase":"最盛"},{"id":16,"month":3,"start_day":16,"end_day":20,"name":"辛夷空に白し","reading":"こぶしそらにしろし","confidence":"A+","category":"植物","phase":"開始・最盛"},{"id":17,"month":3,"start_day":21,"end_day":25,"name":"桜ほころぶ","reading":"さくらほころぶ","confidence":"S","category":"植物","phase":"開始"},{"id":18,"month":3,"start_day":26,"end_day":31,"name":"白蝶初めて舞う","reading":"しろちょうはじめてまう","confidence":"A","category":"昆虫","phase":"開始"},{"id":19,"month":4,"start_day":1,"end_day":5,"name":"菫野を彩る","reading":"すみれのをいろどる","confidence":"A+","category":"植物","phase":"最盛"},{"id":20,"month":4,"start_day":6,"end_day":10,"name":"欅街を青む","reading":"けやきまちをあおむ","confidence":"S","category":"植物","phase":"開始"},{"id":21,"month":4,"start_day":11,"end_day":15,"name":"燕街に帰る","reading":"つばめまちにかえる","confidence":"S","category":"鳥","phase":"開始"},{"id":22,"month":4,"start_day":16,"end_day":20,"name":"躑躅街を染む","reading":"つつじまちをそむ","confidence":"A+","category":"植物","phase":"最盛"},{"id":23,"month":4,"start_day":21,"end_day":25,"name":"花水木街を飾る","reading":"はなみずきまちをかざる","confidence":"A+","category":"植物","phase":"開始・最盛"},{"id":24,"month":4,"start_day":26,"end_day":30,"name":"藤花垂る","reading":"ふじはなたる","confidence":"S","category":"植物","phase":"最盛"},{"id":25,"month":5,"start_day":1,"end_day":5,"name":"黄鶲森に歌う","reading":"きびたきもりにうたう","confidence":"A+","category":"鳥","phase":"開始・最盛"},{"id":26,"month":5,"start_day":6,"end_day":10,"name":"野茉莉花匂う","reading":"えごのはなにおう","confidence":"A+","category":"植物","phase":"最盛"},{"id":27,"month":5,"start_day":11,"end_day":15,"name":"青蛙田に声満つ","reading":"あおがえるたにこえみつ","confidence":"S","category":"両生類","phase":"開始・最盛"},{"id":28,"month":5,"start_day":16,"end_day":20,"name":"時鳥鳴き初む","reading":"ほととぎすなきそむ","confidence":"A+","category":"鳥","phase":"開始"},{"id":29,"month":5,"start_day":21,"end_day":25,"name":"塩辛蜻蛉水辺に増す","reading":"しおからとんぼみずべにます","confidence":"A+","category":"昆虫","phase":"最盛"},{"id":30,"month":5,"start_day":26,"end_day":31,"name":"蕺白む","reading":"どくだみしろむ","confidence":"A+","category":"植物","phase":"開始・最盛"},{"id":31,"month":6,"start_day":1,"end_day":5,"name":"紫陽花雨に映ゆ","reading":"あじさいあめにはゆ","confidence":"A+","category":"植物","phase":"最盛"},{"id":32,"month":6,"start_day":6,"end_day":10,"name":"梅雨空定まる","reading":"つゆぞらさだまる","confidence":"S","category":"気象","phase":"開始"},{"id":33,"month":6,"start_day":11,"end_day":15,"name":"梔子香深し","reading":"くちなしかおりふかし","confidence":"A+","category":"植物","phase":"開始・最盛"},{"id":34,"month":6,"start_day":16,"end_day":20,"name":"蛍水辺に灯る","reading":"ほたるみずべにともる","confidence":"S","category":"昆虫","phase":"開始・最盛"},{"id":35,"month":6,"start_day":21,"end_day":25,"name":"捩花芝に立つ","reading":"ねじばなしばにたつ","confidence":"A+","category":"植物","phase":"開始・最盛"},{"id":36,"month":6,"start_day":26,"end_day":30,"name":"合歓花ひらく","reading":"ねむのはなひらく","confidence":"A+","category":"植物","phase":"開始"},{"id":37,"month":7,"start_day":1,"end_day":5,"name":"蟪蛄声立つ","reading":"にいにいぜみこえたつ","confidence":"S","category":"昆虫","phase":"開始"},{"id":38,"month":7,"start_day":6,"end_day":10,"name":"山百合香り立つ","reading":"やまゆりかおりたつ","confidence":"A+","category":"植物","phase":"開始・最盛"},{"id":39,"month":7,"start_day":11,"end_day":15,"name":"蜩夕べを告ぐ","reading":"ひぐらしゆうべをつぐ","confidence":"S","category":"昆虫","phase":"開始"},{"id":40,"month":7,"start_day":16,"end_day":20,"name":"蓮朝にひらく","reading":"はすあさにひらく","confidence":"S","category":"植物","phase":"最盛"},{"id":41,"month":7,"start_day":21,"end_day":25,"name":"甲虫樹液に集う","reading":"かぶとむしじゅえきにつどう","confidence":"A","category":"昆虫","phase":"最盛"},{"id":42,"month":7,"start_day":26,"end_day":31,"name":"油蝉街を満たす","reading":"あぶらぜみまちをみたす","confidence":"S","category":"昆虫","phase":"最盛"},{"id":43,"month":8,"start_day":1,"end_day":5,"name":"法師蝉鳴き初む","reading":"ほうしぜみなきそむ","confidence":"S","category":"昆虫","phase":"開始"},{"id":44,"month":8,"start_day":6,"end_day":10,"name":"狐剃刀野に灯る","reading":"きつねのかみそりのにともる","confidence":"A","category":"植物","phase":"開始・最盛"},{"id":45,"month":8,"start_day":11,"end_day":15,"name":"流星夜空を渡る","reading":"りゅうせいよぞらをわたる","confidence":"S","category":"天文","phase":"最盛"},{"id":46,"month":8,"start_day":16,"end_day":20,"name":"秋虫夜に鳴き出す","reading":"あきむしよるになきだす","confidence":"S","category":"昆虫","phase":"開始"},{"id":47,"month":8,"start_day":21,"end_day":25,"name":"百日紅街を彩る","reading":"さるすべりまちをいろどる","confidence":"B+","category":"植物","phase":"最盛"},{"id":48,"month":8,"start_day":26,"end_day":31,"name":"葛花咲き初む","reading":"くずはなさきそむ","confidence":"A","category":"植物","phase":"開始"},{"id":49,"month":9,"start_day":1,"end_day":5,"name":"露草朝に青む","reading":"つゆくさあさにあおむ","confidence":"A+","category":"植物","phase":"最盛"},{"id":50,"month":9,"start_day":6,"end_day":10,"name":"朝露葉に宿る","reading":"あさつゆはにやどる","confidence":"A","category":"気象","phase":"開始・最盛"},{"id":51,"month":9,"start_day":11,"end_day":15,"name":"彼岸花野に立つ","reading":"ひがんばなのにたつ","confidence":"S","category":"植物","phase":"開始"},{"id":52,"month":9,"start_day":16,"end_day":20,"name":"萩野にこぼる","reading":"はぎのにこぼる","confidence":"A+","category":"植物","phase":"最盛"},{"id":53,"month":9,"start_day":21,"end_day":25,"name":"稲穂黄金に垂る","reading":"いなほこがねにたる","confidence":"A+","category":"植物・農景観","phase":"最盛"},{"id":54,"month":9,"start_day":26,"end_day":30,"name":"赤蜻蛉野に戻る","reading":"あかとんぼのにもどる","confidence":"A+","category":"昆虫","phase":"開始"},{"id":55,"month":10,"start_day":1,"end_day":5,"name":"薄穂風に光る","reading":"すすきのほかぜにひかる","confidence":"A+","category":"植物","phase":"最盛"},{"id":56,"month":10,"start_day":6,"end_day":10,"name":"金木犀香る","reading":"きんもくせいかおる","confidence":"S","category":"植物","phase":"開始・最盛"},{"id":57,"month":10,"start_day":11,"end_day":15,"name":"百舌高鳴く","reading":"もずたかなく","confidence":"S","category":"鳥","phase":"開始"},{"id":58,"month":10,"start_day":16,"end_day":20,"name":"団栗道に落つ","reading":"どんぐりみちにおつ","confidence":"A+","category":"植物","phase":"最盛"},{"id":59,"month":10,"start_day":21,"end_day":25,"name":"山茶花咲き初む","reading":"さざんかさきそむ","confidence":"A","category":"植物","phase":"開始"},{"id":60,"month":10,"start_day":26,"end_day":31,"name":"尉鶲街に来る","reading":"じょうびたきまちにくる","confidence":"S","category":"鳥","phase":"開始"},{"id":61,"month":11,"start_day":1,"end_day":5,"name":"紅葉葉楓色づく","reading":"もみじばふういろづく","confidence":"S","category":"植物","phase":"最盛"},{"id":62,"month":11,"start_day":6,"end_day":10,"name":"鶫街に現る","reading":"つぐみまちにあらわる","confidence":"A+","category":"鳥","phase":"開始"},{"id":63,"month":11,"start_day":11,"end_day":15,"name":"紅葉森燃ゆ","reading":"もみじもりもゆ","confidence":"S","category":"植物","phase":"最盛"},{"id":64,"month":11,"start_day":16,"end_day":20,"name":"銀杏街を照らす","reading":"いちょうまちをてらす","confidence":"S","category":"植物","phase":"最盛"},{"id":65,"month":11,"start_day":21,"end_day":25,"name":"八手花ひらく","reading":"やつではなひらく","confidence":"A+","category":"植物","phase":"開始・最盛"},{"id":66,"month":11,"start_day":26,"end_day":30,"name":"鴨水面に集う","reading":"かもみなもにつどう","confidence":"S","category":"鳥","phase":"最盛"},{"id":67,"month":12,"start_day":1,"end_day":5,"name":"冬星冴える","reading":"ふゆぼしさえる","confidence":"A","category":"天文","phase":"最盛"},{"id":68,"month":12,"start_day":6,"end_day":10,"name":"螳螂卵を残す","reading":"かまきりたまごをのこす","confidence":"A","category":"昆虫","phase":"最盛"},{"id":69,"month":12,"start_day":11,"end_day":15,"name":"双子星雨降る","reading":"ふたごぼしあめふる","confidence":"S","category":"天文","phase":"最盛"},{"id":70,"month":12,"start_day":16,"end_day":20,"name":"冬芽枝に露わ","reading":"ふゆめえだにあらわ","confidence":"S","category":"植物","phase":"最盛"},{"id":71,"month":12,"start_day":21,"end_day":25,"name":"霜朝を白くす","reading":"しもあさをしろくす","confidence":"S","category":"気象","phase":"開始"},{"id":72,"month":12,"start_day":26,"end_day":31,"name":"氷水辺に張る","reading":"こおりみずべにはる","confidence":"S","category":"気象","phase":"開始"}]
